{
  "$schema": "../schemas/primitive-impact-review-evidence.schema.json",
  "schemaVersion": 1,
  "reviewer": {
    "id": "codex.independent_primitive_impact_review",
    "type": "independent-agent-review",
    "independentOf": "implementation-author"
  },
  "reviewedAt": "2026-10-24T06:46:10Z",
  "reviewScope": "decision-to-primitive-impact",
  "target": {
    "primitiveCatalogSha256": "e623cad93e9f62087d85af434ff8fd63aa1428dcfabf5a4972304a03586ecb56",
    "primitiveSourcesSha256": "3f378427ed764ae38c0c789bb1571c367fb96bd095c4219b0eba827bd220cb1e",
    "decisionSetSha256": "fcb9e77287e6106e4030317b8d79f315831d73282dd7a657c9903fb91d200eea",
    "architectureReleaseManifestCommit": "6392c3770219304a78393faac42276e12eb1525f",
    "architectureSourceCommit": "e1cb20f94ee398c8a26899cc6219b380975da3ca",
    "decisionInventorySha256": "9aad2877bbb89589d704eeebbeaef9e4a1850d70429125cf1d1041b2b106f59b"
  },
  "outcome": "no-blocking-mapping-findings",
  "summary": "Separate read-only AI review /root/review_pr4 found no blocking mappings for all 24 pinned decisions and 16 primitives. Delivery role 0.2.0 implements the instructional W08 allowance, W02 runner exclusions and ADR-0024 admitted Requirements-reference boundaries. Current candidate evaluation references use the verified Customizations name; immutable historical baseline references remain unchanged. No runtime admission or human approval is established.",
  "limitations": [
    "This evidence records an independent AI review; it does not replace human approval or adopt proposed Architecture decisions.",
    "Hashes bind the review to exact artifacts but cannot prove the semantic reasoning or make a judgment objectively true.",
    "Selected Architecture draft.77 is not an approved runtime context. This draft candidate preserves five proposed-origin impact rows and all released-artifact admission gates."
  ],
  "findings": [
    {
      "id": "IMPACT-001",
      "severity": "P1",
      "finding": "A released Primitive could previously accept a draft Architecture release and provisional decision mappings.",
      "status": "addressed",
      "resolution": "Release-readiness validation now requires a released Architecture pin and zero provisional decisions, with regression tests for both conditions."
    },
    {
      "id": "IMPACT-002",
      "severity": "P1",
      "finding": "The impact manifest did not preserve an independent review identity or bind review evidence to exact artifacts.",
      "status": "addressed",
      "resolution": "A schema-validated review record now pins the catalog bytes, canonical decision set, Architecture manifest commit, source commit, and inventory digest."
    }
  ]
}
